campaign_id,project_id,project_title,project_url,project_context
26094,367053-48088,CardanoSharp - Unity SDK,https://cardano.ideascale.com/a/dtd/CardanoSharp-Unity-SDK/367053-48088,Game Developers using the Unity game engine do not have easy integrated solutions to support tokens and NFTs in their games.
26094,367051-48088,CardanoSharp - UnrealEngine SDK,https://cardano.ideascale.com/a/dtd/CardanoSharp-UnrealEngine-SDK/367051-48088,Game Developers using the UnrealEngine game engine do not have easy integrated solutions to support tokens and NFTs in their games.
26094,367009-48088,Incentivized Developer Training,https://cardano.ideascale.com/a/dtd/Incentivized-Developer-Training/367009-48088,"Cardano development is hard, with a steep learning curve. The economically disadvantaged cannot easily afford the time and effort."
26094,366977-48088,Software as a Service for Cardano,https://cardano.ideascale.com/a/dtd/Software-as-a-Service-for-Cardano/366977-48088,Developers need to deploy infrastructure to communicate with Cardano. This time-consuming and costly task stops the development of new ideas
26094,366952-48088,Africa/Diaspora Dev Tools & Events,https://cardano.ideascale.com/a/dtd/Africa-Diaspora-Dev-Tools-Events/366952-48088,"WADA is rapidly expanding beyond West Africa, in order to sustain and support our growth we need to maintain hosting regular events."
26094,366928-48088,Ranking projects built on cardano,https://cardano.ideascale.com/a/dtd/Ranking-projects-built-on-cardano/366928-48088,Lack of a plateform where investors can find the best projects built on cardano and where the entrepreneurs can go to raise additional funds
26094,366904-48088,Layer 2 Advanced Architecture,https://cardano.ideascale.com/a/dtd/Layer-2-Advanced-Architecture/366904-48088,"Cardano NEEDS a cutting edge layer 2 data solution that will handle large volumes of, and high rates of, irregular and complex data."
26094,366871-48088,CCC: Work|Live|Play@MOA,https://cardano.ideascale.com/a/dtd/CCC-Work-Live-Play@MOA/366871-48088,"WLP onboard, educate, incubate accelerator reduces effort&friction while compressing time&space between pro-development phases, non-existent"
26094,366836-48088,Withdrawn,https://cardano.ideascale.com/a/dtd/Withdrawn/366836-48088,I have withdrawn this proposal to refine it for Fund 7
26094,366817-48088,CCC: Reset Ready?|Value-Flow Wealth,https://cardano.ideascale.com/a/dtd/CCC-Reset-Ready-Value-Flow-Wealth/366817-48088,"""Reset Ready?"" Onboard EVENT + Highly Incentivized Stake Pool Loyalty Rewards; currently lack DEVELOPER DRIVEN toroidal value-flow."
26094,366790-48088,NITTYGRITTY (NEW MEDIA),https://cardano.ideascale.com/a/dtd/NITTYGRITTY-NEW-MEDIA/366790-48088,YouTube style apps are constantly censoring content creators by deleting their video or demonetizing them.
26094,366736-48088,Visual DAO Framework,https://cardano.ideascale.com/a/dtd/Visual-DAO-Framework/366736-48088,DAO simulation & visualization is not accessible.
26094,366734-48088,CCC: Cardano Multiversity MVP,https://cardano.ideascale.com/a/dtd/CCC-Cardano-Multiversity-MVP/366734-48088,"CCC will provide meaningful, memorable, motivational learning & skills transference experiences w/measurable results, currently non-existent"
